job_id,company,apply_link,job_link,job_posted,title,salary,job_type,shift_schedule,benefits,location,description
15a30e6124a27412,NextBridge Solutions,https://in.indeed.com/applystart?jk=15a30e6124a27412&from=vj&pos=bottom&mvj=0&jobsearchTk=1i57u5tn3ks8p8a3&spon=0&xkcb=SoDK67M39n0YYM29mR0LbzkdCdPP&xfps=c954d786-aa79-404f-b36a-2639d460d911&sjdu=h3Vce4w-Kso1hU8rfRz7CfWWUXkDbBfVKRXoRPlQYucitwQRXRtAmB5NvRdrSmCui60xMf-T4rb4s0QA6V8rzg&vjfrom=vjs&asub=mob&astse=bf639d95086bbd18&assa=7456,https://in.indeed.com/rc/clk?jk=15a30e6124a27412&bb=2zrr_dn6-QvdTphPjDmwcBtnWhaxxca_UvXIUT-DMpzCjpxC2GX1es4gTY2DbLJYNUk075Kn3dJmP3-pJCVEFUa6b12_DPX2cT9bRB_jofR-tef3C7srqU5f9xTBg-3l&xkcb=SoDK67M39n0YYM29mR0LbzkdCdPP&fccid=0230eafc1bd9bcd8&vjs=3,14/08/2024,Associate Software Engineer,,"['Full-time', 'Internship']",[],Flexible schedule,"Pune, Maharashtra","{'Requirements': ['Must have knowledge in Angular JS, NodeJS, Java script. And, HTML5, Web Services.', 'Education Qualification (Degree/Branch): BCA, B.Tech, BE', 'Able to work with minimal supervision', 'Excellent listening and presentation skills']}"
33262d53d93d47f5,NIFTY ALGO / FOREX ALGO PRO,apply through indeed,https://in.indeed.com/rc/clk?jk=33262d53d93d47f5&bb=2zrr_dn6-QvdTphPjDmwcGeS0AmUksZmxtbFeoTpNCKmUTHNtLz73Zg3w32Zme7Q3-ngzYaG7QOou7vsEX3I6nkG1YOiZUqYM2INBoTa8vTy5JX2b1R-U111w7e34oZp&xkcb=SoDj67M39n0YYM29mR0JbzkdCdPP&fccid=d5527ccd9e05f119&cmp=NIFTY-ALGO-%252F-FOREX-ALGO-PRO&ti=Front+End+Developer&vjs=3,07/08/2024,UI/UX and Website Developer,"₹2,82,951.49 - ₹14,00,188.93 a year","['Part-time', 'Temporary', 'Contract']","['Day shift', 'Monday to Friday']",,,"{'Job Responsibilities': ['Website Development: Design, develop, and maintain our WordPress website to ensure a seamless and engaging user experience.', 'UI/UX Design: Create visually appealing and intuitive interfaces that resonate with Gen Z users, ensuring a smooth and enjoyable user journey.', 'Integration: Implement and manage multiple payment gateways, ensuring secure and efficient transactions for our global customer base.', 'Auto Responders: Set up and manage automated email responders to enhance customer engagement and retention.', 'Pop-Ups & Lead Magnets: Design and implement pop-ups and lead magnets to capture and convert website visitors into leads and customers.', 'Affiliate Setup: Develop and manage an affiliate program to expand our reach and drive sales through partnerships.', 'Continuous Improvement: Stay updated with the latest UI/UX trends and WordPress developments to continuously enhance the website and user experience.'], 'Qualifications': ['Experience: Proven experience in UI/UX design and WordPress website development.', 'Skills: Strong proficiency in HTML, CSS, JavaScript, and PHP. Familiarity with design tools like Adobe XD, Sketch, or Figma.', 'Integration Knowledge: Experience with integrating multiple payment gateways (e.g., Stripe, PayPal) and setting up auto responders (e.g., Mailchimp, ActiveCampaign).', 'Creativity: Ability to create Gen Z-friendly designs that are visually appealing and highly functional.', 'Analytical Skills: Strong problem-solving skills and attention to detail. Ability to analyze user behavior and feedback to make informed design decisions.', 'Communication: Excellent verbal and written communication skills. Ability to work collaboratively with a remote team.', 'Passion: A genuine interest in fintech, trading, and delivering exceptional user experiences.'], 'Why Join Us': ['Innovative Environment: Work with a forward-thinking company at the forefront of automated trading technology.', 'Flexible Working: Enjoy the flexibility of remote work or join us at our office in [Your Location].', 'Growth Opportunities: Take on new challenges and grow your career with us.', 'Creative Freedom: Bring your creative ideas to life and make a significant impact on our brand and user experience.', 'Supportive Team: Join a collaborative and supportive team that values your input and ideas.'], 'Supplemental Pay': ['Performance bonus'], 'Education': ['Higher Secondary(12th Pass) (Preferred)'], 'Experience': ['WordPress: 3 years (Required)', 'total work: 1 year (Preferred)', 'HTML5: 1 year (Preferred)'], 'License/Certification': ['Magneto (Preferred)']}"
d084742d2296ff33,infobeckons technologies,apply through indeed,https://in.indeed.com/rc/clk?jk=d084742d2296ff33&bb=2zrr_dn6-QvdTphPjDmwcAaTyifQKs6t5hK9N-A9SaNFadizUibgTD71MpbpzIO0FtR7QRt34zeMXmcUN0GPrcvXyQLXe6dXpi7axJrCW6ChnPAud_OgZYB__H5gSqOe&xkcb=SoBX67M39n0YYM29mR0IbzkdCdPP&fccid=a60ecf2820bbee83&cmp=Infobeckons-Technologies&ti=Web+Developer&vjs=3,13/08/2024,Web Developer,"₹15,000 - ₹20,000 a month",['Full-time'],['Day shift'],,"Chandigarh, Chandigarh","{'WordPress Developer Requirements': ['Bachelor’s degree in computer science or a similar field.', 'Proven work experience as a WordPress developer.', 'Knowledge of front-end technologies including CSS3, JavaScript, HTML5, and jQuery.', 'Knowledge of code versioning tools including Git, Mercurial, and SVN.', 'Experience working with debugging tools such as Chrome Inspector and Firebug.', 'Good understanding of website architecture and aesthetics.', 'Ability to manage projects.', 'Good communication skills.'], 'Education': [""Bachelor's (Preferred)""], 'Experience': ['CSS: 1 year (Preferred)', 'total work: 1 year (Preferred)', 'HTML5: 1 year (Preferred)']}"
b46c643370b8de98,Rishikesh Yogkulam,apply through indeed,https://in.indeed.com/rc/clk?jk=b46c643370b8de98&bb=2zrr_dn6-QvdTphPjDmwcAkrss0Y_TurLnZHoxJUb8EU5FH_dlUGTnilU_I6FUGZKjBTSg7CbeL2jhw5zl9jtcArPpKHzc6zFd73k2k9MaFZ1P24xBLuGsXfJvB1K3Y_&xkcb=SoDZ67M39n0YYM29mR0PbzkdCdPP&fccid=39bb89148d05d3d7&cmp=Rishikesh-Yogkulam&ti=Web+Developer&vjs=3,09/08/2024,Web Developer,"₹10,000 - ₹12,000 a month",['Part-time'],['Day shift'],Flexible schedule,"Rishikesh, Uttarakhand","{'Objectives of this role': ['Create well-designed and tested code using best practices for web development, including for responsive design and mobile display.', 'Create websites and interfaces using standard HTML/CSS practices, and incorporate data from back-end databases and services.', 'Develop or validate testing schedules that address all browsers and devices, ensuring web content can be accessed on any computer'], 'Required skills and qualifications': ['Experience in planning and developing websites across multiple products and organizations', 'Extensive knowledge of web applications, programming languages, and web services — including API, CSS, CSS3, cross-browser compatibility, HTML, HTML5, JavaScript, jQuery, PHP, security principles, REST, SOAP, and web user interface design'], 'Benefits': ['Flexible schedule', 'Work from home'], 'Supplemental Pay': ['Yearly bonus'], 'Ability to commute/relocate': ['Rishikesh, Uttarakhand: Reliably commute or planning to relocate before starting work (Preferred)'], 'Application Question(s)': ['Do you have any experience on On Page SEO?'], 'Education': [""Bachelor's (Preferred)""], 'Experience': ['PHP: 4 years (Required)', 'HTML5/CSS: 4 years (Required)', 'total work: 4 years (Required)']}"
9b18fa75ce681a9b,SRV InfoTech,apply through indeed,https://in.indeed.com/rc/clk?jk=9b18fa75ce681a9b&bb=2zrr_dn6-QvdTphPjDmwcOK60iqA5j3gX1uGRut3Fe1g0iEa77rC1IJouQLRxiJlnynQ1_hBoI5jlMGj_J8AivK47NyCKxEyTIuRBrZvwdUBRKnAM07O1Tugo86JgQU7&xkcb=SoBt67M39n0YYM29mR0ObzkdCdPP&fccid=2ae127d3a7b321b7&cmp=SRV-InfoTech&ti=Web+Designer&vjs=3,14/08/2024,Web Designer,,['Full-time'],['Day shift'],,"Cannanore, Kerala","{'Education': ['Higher Secondary(12th Pass) (Preferred)'], 'Experience': ['total work: 1 year (Required)']}"
e262626bf254613d,CapSync,apply through indeed,https://in.indeed.com/rc/clk?jk=e262626bf254613d&bb=2zrr_dn6-QvdTphPjDmwcBDCjD5HxTbsJJ6rSHWrjhJow96VPhfWtwIjtJYMpOhF2iOUvH_4i_i2Zz0db-IUVxlfem6xnp-JIvbG6EBnNliZ8V_6slRY3JpNFiSixjoV&xkcb=SoBE67M39n0YYM29mR0MbzkdCdPP&fccid=98c22ea75d7ee02a&cmp=CapSync&ti=Web+Designer&vjs=3,11/08/2024,Web Designer,,"['Full-time', 'Permanent']","['Weekend availability', 'Day shift', 'Monday to Friday']",Leave encashment,"Adajan, Surat, Gujarat","{'Key responsibilities': ['Handle multiple applications Visual Design such as Web based Applications.', 'Strong development skills and experience in hand-coding HTML5, CSS.', 'Good knowledge of Adobe Photoshop & Illustrator.', 'Strong Experience in WordPress Customization and Administration.', 'Understanding of Grid Systems & Responsive Design.', 'Browser debugging tools Google Chrome Developer Tool, Firefox Firebug.', 'Exposure to good web development practices like W3C standards.', 'Good skills in JavaScript / JQuery & Various frameworks.', 'Good Experience with PHP development and PHP Frameworks.', 'Competent Java script, jQuery, Prototype JS coding abilities', 'Experience using version control systems (SVN, Git)', 'Understanding client requirements and functional specifications.', 'Designing, developing, maintaining and optimizing secure and scalable multi-tier web applications'], 'Qualification': ['Minimum 3+ years of experience', 'Excellent Verbal & Written communication skills', 'Bachelor’s degree in any IT field', 'Only Experienced Candidate can apply', 'Strong creative and Innovative skills'], 'Benefits': ['Leave encashment', 'Paid sick time', 'Paid time off'], 'Ability to commute/relocate': ['Adajan, Surat, Gujarat: Reliably commute or planning to relocate before starting work (Preferred)']}"
238c784cb9b1f95c,Vaikunth Technologies,apply through indeed,https://in.indeed.com/rc/clk?jk=238c784cb9b1f95c&bb=2zrr_dn6-QvdTphPjDmwcHC0obTpzzMo5dAdoq27fHF4zMOQCQqTVVRcWV89DOqaDDiN7Khf0b1u11jlSiRaOKqqLMtFIjjy4omIk70hlxoLVTuSW9qnpr3Jsi9Sd0Hc&xkcb=SoAZ67M39n0YYM29mR0CbzkdCdPP&fccid=c7798c6038dd8616&cmp=Vaikunth-Technologies&ti=PHP+Developer&vjs=3,12/08/2024,PHP Web Developer,"₹10,000 - ₹35,000 a month",['Full-time'],['Monday to Friday'],Leave encashment,"Bhavnagar, Gujarat","{'Benefits': ['Leave encashment', 'Paid time off'], 'Supplemental Pay': ['Yearly bonus']}"
d80c01edfeebda0a,BOEING,https://in.indeed.com/applystart?jk=d80c01edfeebda0a&from=vj&pos=bottom&mvj=0&jobsearchTk=1i57u5tn3ks8p8a3&spon=0&xkcb=SoCE67M39n0YYM29mR0BbzkdCdPP&xfps=ac352ae9-b8bf-4284-a363-3e529d5b29eb&sjdu=BQ1fOKU6SMjz57AxXCzG64DDplm6SwWjHcxyoDIphKkf0dOtx-mwozLtpbNUMN-1wJiwLjADAuPklBKrV7BcVHAZPKPv2wES1Uiu-vPbqqGJmgAVBIhWuudim61rwbYOzJZDjlbgB3M1mkLUjm3rUs-_K4AOjeoTdFmRuyrNfESmKRQ9Ku7lQLzTCOUhJVtvw9_XINGINv7OnqX9-Wv1cg&vjfrom=vjs&asub=mob&astse=a0df2182119d32d9&assa=7250,https://in.indeed.com/rc/clk?jk=d80c01edfeebda0a&bb=2zrr_dn6-QvdTphPjDmwcAaTyifQKs6tina2EANOY9eoq-ZkAeuzuU20P-ajKapNJjhGxeqpOmdvgTtQN7Tm1poUuzR4Urwy6kuWjEh2NSGCBWOGKaayZQ%3D%3D&xkcb=SoCE67M39n0YYM29mR0BbzkdCdPP&fccid=edae4285faf6c2f0&vjs=3,11/08/2024,Associate Web Developer,,[],[],,"Bengaluru, Karnataka","{'Position Responsibilities': ['Experience in planning and delivering web development projects across organizational units.', 'Convert functional requirements to CLEAR specific technical requirements.', 'Development and maintenance of web application customized per business requirements.', 'Candidate must have a strong understanding of UI, cross-browser compatibility, general web functions and standards.', ""Deep expertise and hands on experience with Web Applications and programming languages such as HTML, CSS, JavaScript, JQuery and API's."", 'Research and propose software programs that are compatible to the future technologies.', 'Preparation of technical documentation.', 'Fix bugs, troubleshoot and resolve problems.', 'Assume ownership of code throughout development, staging, testing and production.', 'Excellent communication, interpersonal skills & ability to work with multiple personality types.'], 'Basic Qualifications (Required Skills/Experience)': ['A Bachelor’s degree or higher is required as a BASIC QUALIFICATION', '6+ years of experience as web developer', 'C#, MVC, ASP.Net 3.5,4.0, WIF, WCF, Web Services, Windows Services', 'Knowledge on Cloud Platform (Azure/AWS/Google)', 'SQL server 2005/2012/2014, SQL PaaS, SQL MI, Oracle, MySQL', 'Jquery, Angular JS, Angular framework, CSS, HTML, Bootstrap', 'Tools – GitHub, ADO, Visual studio']}"
c04537efef4cf736,ADCI - Karnataka,https://in.indeed.com/applystart?jk=c04537efef4cf736&from=vj&pos=bottom&mvj=0&jobsearchTk=1i57u5tn3ks8p8a3&spon=0&xkcb=SoAw67M39n0YYM29mR0AbzkdCdPP&xfps=776e3e7f-8a4f-4fd1-b3ab-b7bebf16cd18&sjdu=BQ1fOKU6SMjz57AxXCzG64DDplm6SwWjHcxyoDIphKlAnc9E6fdTlh2A4emViK51LaaTH7LwDvAJ5MveM4H0jZ_12AfyhSB2KkD0IJMDuleERVVxSFO611AUwdauaDYXfYyHdsM58aecriYiwsB_skEapc9jUHMFPdMe5MPIs5BXk72F65Xf1fkcMhokkmRSw9_XINGINv7OnqX9-Wv1cg&vjfrom=vjs&asub=mob&astse=a88f6fa769f69409&assa=9904,https://in.indeed.com/rc/clk?jk=c04537efef4cf736&bb=2zrr_dn6-QvdTphPjDmwcFGpbSh9IF2AhlqLxPFkpPPkM1y7JT9ciqvb60mwQUw8HBQU2nyICYms8VXjSzVv-mRlaBBqK9GwiJknVHAz8Ddrezle4DRVFw%3D%3D&xkcb=SoAw67M39n0YYM29mR0AbzkdCdPP&fccid=fe2d21eef233e94a&vjs=3,13/08/2024,"Frontend Engineer II, Amazon IN Payments",,['Full-time'],[],,"Bengaluru, Karnataka",{}
704732a1105f8693,Suretek Infosoft Pvt. Ltd.,apply through indeed,https://in.indeed.com/rc/clk?jk=704732a1105f8693&bb=2zrr_dn6-QvdTphPjDmwcKn4m8VkBgl_S3x92kFrcTFpQzkHRkDnlh-pRZKJZ9IfUp4D38Ou3b2xz0dS6W1OKMg8hmiHsVfD7JpXoLtT9yq4HpAz7fEpUjm4D73dW-3i&xkcb=SoC-67M39n0YYM29mR0HbzkdCdPP&fccid=d5d9814b3d4c381b&cmp=Suretek-Infosoft&ti=Graphic+Designer&vjs=3,10/08/2024,Internship-Web/Graphic Designer,"₹5,000 - ₹10,000 a month","['Full-time', 'Permanent']","['Morning shift', 'Day shift']",,"Noida, Uttar Pradesh","{'Requirements': ['Graduation/PG', 'Good communication skills', 'Technical knowledge-(HTML, Javascript, CSS, Photoshop, Dreamweaver, InDesign,)'], 'Education': [""Bachelor's (Preferred)""]}"
8dae6a64936f39e1,Blue Moon Technologies,apply through indeed,https://in.indeed.com/rc/clk?jk=8dae6a64936f39e1&bb=2zrr_dn6-QvdTphPjDmwcP2F4WFYDYLwBZtOfgWk_bMzmOaLWsn4lCnMi-YZMOuLrssb87KF59XTPi751foC81z_DaW4_UVoDsRov50qtEHrlwPldNx0cONj7bCUbGVf&xkcb=SoAK67M39n0YYM29mR0GbzkdCdPP&fccid=95bc5f9f133a389a&cmp=Blue-Moon-Technologies&ti=Web+Designer&vjs=3,11/08/2024,"Web Designer & Developer - Must know Wordpress, Shopify","₹3,000 - ₹12,000 a month","['Full-time', 'Internship', 'Fresher']",['Morning shift'],,"Janakpuri, Delhi, Delhi",{'Supplemental Pay': ['Performance bonus']}
57b2c4f157db31fb,Bizzeonline,apply through indeed,https://in.indeed.com/rc/clk?jk=57b2c4f157db31fb&bb=2zrr_dn6-QvdTphPjDmwcKpl4Mh6gGKrkhHxdGLYs33F1xv3Up4Sm1jevjlWDDi_smorBJ0tBDIYLleA9NyGgVDOKw87SFRMjs-gCnRFHJSBj_Jsb6MQgsl8RVC777qN&xkcb=SoCX67M39n0YYM29mR0FbzkdCdPP&fccid=69dc9decea6393b8&cmp=Bizzeonline&ti=Full+Stack+Developer&vjs=3,11/08/2024,Full Stack Web Developer,"₹30,000 - ₹45,000 a month","['Full-time', 'Permanent']",['Day shift'],Flexible schedule,"Mira Road, Mumbai, Maharashtra","{'Key Responsibilities': ['Design Frontend of Website using HTML, CSS, JS & Bootstrap', 'Developed Backend of Website (either Php or Asp.net)', 'Develop and maintain websites using HTML, CSS, JavaScript with one Backend Technology', 'Knowledge of wordpress will be aditional benefit', 'Collaborate with designers to translate mockups into fully functional websites.', 'Customize WordPress themes and plugins to meet specific project requirements.', 'Ensure website functionality and performance across different browsers and devices.', 'Troubleshoot and resolve website issues and bugs.', 'Optimize websites for speed and SEO.', 'Stay up-to-date with the latest web development trends and technologies.'], 'Requirements': ['Proven experience as a Website Developer.', 'Strong proficiency in HTML, CSS, and JavaScript.', 'Extensive experience with WordPress development, including theme and plugin customization.', 'Solid knowledge of PHP and MySQL.', 'Familiarity with responsive design principles and mobile-first development.', 'Understanding of SEO best practices.', 'Strong problem-solving skills and attention to detail.', 'Excellent communication and teamwork abilities.', 'Ability to manage multiple projects and meet deadlines.'], 'Preferred Qualifications': ['Experience with additional content management systems (CMS) and frameworks.', 'Knowledge of web performance optimization techniques.', 'Familiarity with version control systems such as Git.', 'Experience with e-commerce platforms and payment gateway integration.', 'Basic understanding of graphic design principles and tools (e.g., Adobe Photoshop, Illustrator).'], 'What We Offer': ['Competitive salary and benefits package.', 'Flexible working hours and remote work options.', 'Opportunity to work on exciting projects with a talented team.', 'Professional development and growth opportunities.', 'A supportive and inclusive work environment.'], 'Benefits': ['Health insurance', 'Internet reimbursement', 'Paid sick time', 'Provident Fund'], 'Location Type': ['In-person'], 'Education': [""Bachelor's (Preferred)""], 'Experience': ['total work: 3 years (Preferred)']}"
743b51d9cc116be9,BP Energy,https://in.indeed.com/applystart?jk=743b51d9cc116be9&from=vj&pos=bottom&mvj=0&jobsearchTk=1i57u750mh31j84q&spon=1&adid=413093732&xkcb=SoA26_M39n0TfjRUrh0LbzkdCdPP&xfps=745b292f-996a-43e9-ad29-d726bfe9974d&sjdu=i6xVERweJM_pVUvgf-MzufP_wZDyVPczTVsvYigk1x3VvT5HcBMh1iWzxFle2nF8&vjfrom=vjs&asub=mob&astse=766d22858364a94f&assa=7554,https://in.indeed.com/pagead/clk?mo=r&ad=-6NYlbfkN0AJuMufQUticbCEoYTKm6Qi4JXfmZ22JgbUMD2ChcmVNK_btDYk7qbIrOFLNLEfdYqhCYMA2BCrS12z_SakEJD2SX-kNHFWIARokMYqLncXQmAAW9_OloSnjQm3ce0xmNVla2j-skQOw03r-nuuXT9tuOp6mSGLj8NGV5ZCAbQBYnaH00RFsmF6djIy-StQAHavPbugkN_cw6B-9OAjA_tiO3rGA-xANYHLAA10vH5sgUihMAJmVvvvZo5gfOLnwKhG6_GeiVlmFxJFTVinEEBAZkikV33WQoPlWzPo3fcq9eIgZwsiKdUsgpgsFf9iw9-C8lcuAEblzZRpCdUWUGXkZRFrMrPxlVPW084w00RURaG-xDurmhZKq5tkRWmvlW9br3pAy-VuKXfR2bnnq9S2N53OAcDg9RWSbbH9algEfnVxxcAWUiruxewKjPl5PSD9w5b9p97_t_HZrYB_rhyrPAbAZ7F17yczqydQ18J3-zOsP5cpDoIvzOOLyQ2aUAfAatasKkkLlmzMZK2oYRDACxkYY8q4N1PCHi68JbFPPB5uplTlvpjrvNKWuVpnVxHhLbgxbjikjXGNpPrZko2PQgNx4eHE3BUgSj3Z-Pc9GXiAjb9U3PQ63HYdlh9KO2o=&xkcb=SoA26_M39n0TfjRUrh0LbzkdCdPP&camk=f416UQcMBpACaTafcU4uRg==&p=0&fvj=0&vjs=3,01/08/2024,Enterprise Technology Engineer,,[],[],,,{}
5a20a384f5813cd3,Hatio Innovations,https://in.indeed.com/applystart?jk=5a20a384f5813cd3&from=vj&pos=bottom&mvj=0&jobsearchTk=1i57u750mh31j84q&spon=0&xkcb=SoDr67M39n0TfjRUrh0JbzkdCdPP&xfps=6d8f34fe-595d-4a95-9071-164c61d58e36&sjdu=BQ1fOKU6SMjz57AxXCzG64DDplm6SwWjHcxyoDIphKnhSbrynbsC7S7wZKblnDaacsBDc_VletExVVPVWwQgxsdokdz0xK-PiM86Mk5KLI4XSn23ezaxtMjetXWH-RmyjBylennmgTpqSIJNJiCTN68jV1yP0b0WakeMLWoDlmxwzNM9FHrHcE_EA758vZ1Tw9_XINGINv7OnqX9-Wv1cg&vjfrom=vjs&asub=mob&astse=7b27ce863ee66a8b&assa=9468,https://in.indeed.com/rc/clk?jk=5a20a384f5813cd3&bb=zg86Zk6p73e6taeB_AT2sWpwF3Rifj12_zJSmsOK0EUIfj63Yk5c5Cc4njF76fKzQ8EXkcF1CN9ZGb1lTkspR38eV6zcm9EZOv9dK27spic7TUTvIOq-fZPdbJjnRJ8S&xkcb=SoDr67M39n0TfjRUrh0JbzkdCdPP&fccid=93f9b72bc008e1b1&vjs=3,07/08/2024,Software Development Engineer – II (Frontend),,[],[],Health insurance,India,{}
29ed80ee9dec67d0,Concentrix,https://in.indeed.com/applystart?jk=29ed80ee9dec67d0&from=vj&pos=bottom&mvj=0&jobsearchTk=1i57u750mh31j84q&spon=0&xkcb=SoBf67M39n0TfjRUrh0IbzkdCdPP&xfps=13c7a9f2-b0b9-46e9-b327-d4b8d3086cad&sjdu=BQ1fOKU6SMjz57AxXCzG64DDplm6SwWjHcxyoDIphKnSBcngYw2nCU02eDv0EM8L4ysrdgEby74tqZMohMV34rxdtW0sQbysc3C1pRDMRifveRV57T4vsDF-jE6oMS9Xa1h-35AClViChVPFPadkfMj594_z7EL2fKULLgVvt9wPMTZoTLAz5aZCDWSfSSARw9_XINGINv7OnqX9-Wv1cg&vjfrom=vjs&asub=mob&astse=e80c669d7215ff83&assa=1494,https://in.indeed.com/rc/clk?jk=29ed80ee9dec67d0&bb=zg86Zk6p73e6taeB_AT2se6Gh3lJ73C6Dks2YJpvvSJJDha_zFP39LTL4rHofGnbH1Y0P1Wv09bzV6mHlaWczliZb_EhyVmdGlT1xT47AXcHLh8ORv5EkQ%3D%3D&xkcb=SoBf67M39n0TfjRUrh0IbzkdCdPP&fccid=773041d0d31c442a&vjs=3,06/08/2024,"Frontend Developer, Global Analytic Insights",,['Full-time'],[],Health insurance,"Gurugram, Haryana","{'Responsibilities': ['2+ years of experience in writing code and building functionality with Python, JavaScript (ES6) ReactJS and Google Apps script is a must.', 'Design, develop, and implement web applications and features using JavaScript frameworks (e.g., React, Angular, Vue.js) and libraries', 'Advanced SQL and experience with ETL on OLTP and OLAP databases for creating bounded and unbounded data pipelines, data mart is a must.', 'Participate in code reviews and knowledge sharing within the team.', 'Collaborate with designers, front-end developers, and back-end engineers to translate UI/UX mockups into functional web experiences.', 'Debug and troubleshoot complex JavaScript issues to ensure smooth application functionality.', 'Write clean, maintainable, and well-documented code adhering to best practices.', 'Good to have- knowledge of Python language.'], 'Qualifications': ['Master’s degree in computer science, Artificial Intelligence, or a related field (or equivalent experience).', 'Proven experience in developing and deploying LLM-based systems.', 'Expertise in Python programming and familiarity with deep learning frameworks (e.g., TensorFlow, PyTorch).', 'Experience with vector databases and embedding techniques (e.g., Word2Vec, GloVe).', 'Experience with implementing guardrails and safety measures for AI systems.', 'Experience with cloud platforms like Azure OpenAI, GCP, or Rag is a plus.', 'Excellent communication, collaboration, and problem-solving skills.', 'Passion for innovation and a strong desire to push the boundaries of AI technology.'], 'Additional Skills': ['Experience with Google Looker Studio and MS Power BI.', 'Familiarity with machine learning and text analytics.', 'Experience with building and deploying web applications.']}"
d5bf179e6929a87c,SKY FinServe,apply through indeed,https://in.indeed.com/rc/clk?jk=d5bf179e6929a87c&bb=zg86Zk6p73e6taeB_AT2sYSqzwyR2aY-NWoDAFLC2l_PagBE_HuDosQ1pqzodyfELp_iVw9bIdoxIZmuT-ocfCGuGnO0KRw3HjEz8d2qgT6tYg1lrxcv17gsQ7qDRjxx&xkcb=SoDR67M39n0TfjRUrh0PbzkdCdPP&fccid=f4765fc54e5340de&cmp=SKY-FinServe&ti=Front+End+Developer&vjs=3,11/08/2024,,,[],[],,,"{'Key Responsibilities': ['Develop new user-facing features using ReactJS', 'Build reusable components and front-end libraries for future use', 'Translate designs and wireframes into high-quality code', 'Optimize components for maximum performance across a vast array of web-capable devices and browsers', 'Collaborate with designers, backend developers, and other team members to create seamless user experiences', 'Write clean, maintainable, and efficient code', 'Stay updated with the latest industry trends and technologies to ensure we are always using the best tools and techniques'], 'Requirements': ['Minimum of 6 months of experience working with ReactJS', 'Proficient in JavaScript, including DOM manipulation and the JavaScript object model', 'Strong understanding of ReactJS and its core principles', 'Experience with popular ReactJS workflows (such as Redux or Flux)', 'Familiarity with newer specifications of ECMAScript', 'Experience with data structure libraries (e.g., Immutable.js)', 'Knowledge of isomorphic React is a plus', 'Familiarity with RESTful APIs', 'Knowledge of modern authorization mechanisms, such as JSON Web Token', 'Experience with common front-end development tools such as Babel, Webpack, NPM, etc.', 'Ability to understand business requirements and translate them into technical requirements', 'A knack for benchmarking and optimization', 'Familiarity with code versioning tools such as Git', 'Excellent problem-solving skills and attention to detail', 'Good communication and teamwork skills'], 'Preferred Qualifications': ['Bachelor’s degree in Computer Science, Information Technology, or a related field', 'Experience working in an Agile/Scrum development process', 'Prior experience with responsive and adaptive design'], 'Benefits': ['Leave encashment', 'Paid sick time'], 'Education': [""Bachelor's (Required)""], 'Experience': ['Angular: 1 year (Required)', 'total work: 1 year (Required)', 'HTML5: 1 year (Preferred)'], 'License/Certification': ['Magneto (Preferred)']}"
