job_id,company,apply_link,job_link,job_posted,title,salary,job_type,shift_schedule,benefits,location,description
db1b06c005363de1,Parkqwik,apply through indeed,https://in.indeed.com/rc/clk?jk=db1b06c005363de1&bb=GFlvSWsW6chIpRj53B-qaLjX53LfD7e7c1S-yivFY-s3JiFgajejygKO7iDwqgAEtOxeu-Xnn69xEMHMc2ChidQKIYu_6iWwDUboZeDzNrcpsMtYvH4qpQB10qbS3UaU&xkcb=SoAH67M39nzXaVQNiB1LbzkdCdPP&fccid=921f67dbc03b7d3e&cmp=Parkqwik&ti=Front+End+Developer&vjs=3,10/08/2024,Front End Developer Internship,,"['Full-time', 'Internship']",['Day shift'],Flexible schedule,,"{'Responsibilities': ['Develop responsive and mobile-friendly web applications using HTML, CSS, and JavaScript.', 'Assist in designing and implementing user interfaces and user experiences (UI/UX).', 'Write clean, efficient, and well-documented code.', 'Collaborate with the backend team to integrate frontend and backend systems.', 'Participate in code reviews and contribute to improving the codebase - Stay up-to-date with industry trends and emerging technologies.'], 'Requirements': ['Currently enrolled in a degree program in Computer Science, Web Development, or related field.', 'Strong proficiency in HTML, CSS, and JavaScript.', 'Experience with frontend frameworks like React, Angular, or Vue.js', 'Familiarity with version control systems like Git.', 'Ability to work independently and collaboratively as part of a remote team.', 'Excellent problem-solving skills and attention to detail.'], 'Nice to Have': ['Knowledge of web accessibility guidelines and best practices.', 'Familiarity with backend technologies like Node.js, Ruby on Rails, or Django.'], 'What We Offer': ['Opportunity to gain hands-on experience in frontend development.', 'Flexible working hours.', 'Mentorship and guidance from experienced developers.', 'Opportunity to learn and grow with our company.'], 'Benefits': ['Flexible schedule', 'Work from home'], 'Education': [""Bachelor's (Preferred)""]}"
577dfdeb182f9f09,Talent Corner HR Services Private Limited,apply through indeed,https://in.indeed.com/rc/clk?jk=577dfdeb182f9f09&bb=GFlvSWsW6chIpRj53B-qaKbOPvI_0EYLXfuUz1BxpAn0p4adluqsZFh8Aw97ixuUB6IlCAV2Uhq5kaJJS9AWo1vYN3ZKgDz-Occqyc1IGA73YO-mUVSHRaI2DpLaGTts&xkcb=SoCz67M39nzXaVQNiB1KbzkdCdPP&fccid=0f289a6509f42c20&cmp=Talent-Corner-HR-Services-Private-Limited&ti=Web+Designer&vjs=3,10/08/2024,Web Designer/Developer,"Up to ₹35,000 a month",['Full-time'],['Day shift'],Flexible schedule,,"{'Application Question(s)': ['Do you have proficiency in WordPress and Shopify?', 'What is your current CTC?', 'What is your expected CTC?', 'What is your notice period?'], 'Experience': ['Web development: 1 year (Required)', 'Web design: 1 year (Required)']}"
3149b40045201b16,Rankmantra,apply through indeed,https://in.indeed.com/rc/clk?jk=3149b40045201b16&bb=GFlvSWsW6chIpRj53B-qaLjX53LfD7e7GW3zxyG_0tBUN-JwCARQf3wiNSy2gjZih3dr5ms0OyrlEvxF_4HvRP2YpwobPZQyHcEbxKD17Ey0KuCYT8ZZrEQQbYvxR2Mo&xkcb=SoAu67M39nzXaVQNiB1JbzkdCdPP&fccid=3bdcfb533b0a2aed&cmp=Rankmantra&ti=Web+Designer&vjs=3,14/08/2024,Web Designer,"₹10,000 - ₹18,000 a month",['Full-time'],[],,"Dehradun, Uttarakhand","{'Qualification': ['B.tech or MCA degree.', 'Proficient in WordPress, HTML, Bootstrap or latest design techniques.'], 'Education': [""Bachelor's (Preferred)""], 'Experience': ['PHP: 1 year (Required)', 'web designing: 1 year (Required)', 'total work: 1 year (Required)', 'WordPress: 1 year (Required)']}"
e9d5f0fb115b3109,Sahasrara metatech,apply through indeed,https://in.indeed.com/rc/clk?jk=e9d5f0fb115b3109&bb=GFlvSWsW6chIpRj53B-qaIOUXegRxubajJmmVMSy5f8JWk-wqm4tqW2wqeLlL9fd7UH8J5UDBF_S6x4SJyf_fcttHPai0IxdPG6oz2Kxikbd5q8s2Z_x89rCH0DL3G7Q&xkcb=SoCa67M39nzXaVQNiB1IbzkdCdPP&fccid=659ba435cd76585e&cmp=Sahasrara-metatech&ti=Front+End+Developer&vjs=3,11/08/2024,Front End Developer Intern,"₹1,00,000 - ₹1,80,000 a year","['Full-time', 'Permanent']","['Weekend availability', 'Morning shift', 'Day shift']",Flexible schedule,"Vishnunagar, Thane, Maharashtra","{'Responsibilities': ['Assist in designing, developing, and maintaining frontend components using React and Next.js.', 'Collaborate with UI/UX designers and backend developers to implement user interfaces and features.', 'Write clean, reusable, and well-structured code following best practices and coding standards.', 'Implement responsive designs that work seamlessly across various devices and screen sizes.', 'Optimize web applications for performance, speed, and accessibility.', 'Participate in code reviews to ensure code quality, consistency, and adherence to design guidelines.', 'Debug and troubleshoot issues to identify and implement solutions in a timely manner.', 'Stay updated on the latest trends and advancements in frontend development and web technologies', 'Communicate effectively with team members to ensure smooth project progress and timely delivery.'], 'Requirements': ['Required At least more than 6 months of experience.', 'Strong understanding of front-end development principles and concepts.', 'Proficiency in React and Next.js.', 'Familiarity with HTML5, CSS3, and JavaScript.', 'Experience with responsive and mobile-first design principles.', 'Knowledge of version control systems such as Git.', 'Strong problem-solving skills and attention to detail.', 'Ability to work independently as well as collaboratively in a team environment.', 'Excellent communication and interpersonal skills.', 'Passion for learning and self-improvement in the field of frontend development.'], 'Benefits': ['Hands-on experience in front-end development with modern frameworks.', 'Mentorship and guidance from experienced developers.', 'Exposure to real-world projects and challenges.', 'Opportunity to contribute to the creation of user-friendly and visually appealing web applications.', 'Networking opportunities with industry professionals.', 'Flexible work hours and a supportive work environment.', 'Certificates awarded upon successful completion of the internship, recognizing your contribution and newly acquired skills']}"
3996dde25a0f0478,Sash Info Services Pvt Ltd,apply through indeed,https://in.indeed.com/rc/clk?jk=3996dde25a0f0478&bb=GFlvSWsW6chIpRj53B-qaDi84rakpaoqRE1sKyNveB5R7BTw2gS0eblvzNkk42LC6D3vObYvHnf7qYGKhghQeYCKHjfS64tFdJsYC-pUhj3q4ZG1gtHYi_MM5IezCIJB&xkcb=SoAU67M39nzXaVQNiB1PbzkdCdPP&fccid=aa189eed347132e9&cmp=Sash-Info-Services-Pvt-Ltd&ti=Front+End+Developer&vjs=3,12/08/2024,Front End Web Developer,"₹25,000 a month",['Full-time'],['Day shift'],,"Bengaluru, Karnataka","{'Responsibilities': ['Develop high-quality, responsive, and interactive web applications using HTML, CSS, JavaScript, Ajax, and front-end frameworks like React js, Bootstrap, Tailwind.', 'Collaborate with designers to translate designs into functional and visually appealing web applications.', 'Work with back-end developers to integrate front-end code with server-side logic.', 'Stay up-to-date with industry trends and emerging technologies.'], 'Requirements': ['Bachelors degree in computer science, Information Technology, or related field.', 'Minimum 1 year experience in front-end development.', 'Proven work experience as a Front-End Developer with a strong portfolio of relevant projects.', 'Strong understanding of HTML, CSS, JavaScript, jQuery, Bootstrap, Tailwind and other front-end frameworks.', 'Ability to create designs using Figma / Sketch / Photoshop / Illustrator would be a plus.'], 'Ability to commute/relocate': ['Bengaluru, Karnataka: Reliably commute or planning to relocate before starting work (Required)'], 'Experience': ['total work: 1 year (Required)']}"
d92109f03b8ecf26,BANFIELD'S PROFESSIONAL MEDICAL ENGLISH,apply through indeed,https://in.indeed.com/rc/clk?jk=d92109f03b8ecf26&bb=GFlvSWsW6chIpRj53B-qaIOUXegRxubaJPBLYh8fM9XsbZUrePEGsG7Ls9PFC7cymai9iktcL_f0mxHD8Gdko0icTYJnfoV_PcOzJAr13rGHqVxb2ID-GKB_Z6GHj-uC&xkcb=SoCg67M39nzXaVQNiB1ObzkdCdPP&fccid=5c80e2c01bbe454c&cmp=BANFIELD%2527S-PROFESSIONAL-MEDICAL-ENGLISH&ti=Web+Developer&vjs=3,09/08/2024,Web Developer,"₹9,778.33 - ₹43,153.40 a month","['Full-time', 'Permanent']","['Weekend availability', 'Day shift']",Flexible schedule,,"{'Key Responsibilities': ['Design, develop, and maintain the company website and ensure it aligns with our branding and business objectives.', 'Implement and manage website security measures to protect against threats and vulnerabilities.', 'Optimize website performance, including loading times, responsiveness, and overall user experience.', 'Troubleshoot and resolve website issues promptly, including being available on weekends if urgent problems arise.', 'Collaborate with the marketing and content teams to integrate new features, content, and updates.', 'Ensure the website is SEO-friendly and supports digital marketing efforts.', 'Stay up-to-date with the latest web development and design trends, tools, and technologies.', 'Create and manage backups of the website.', 'Coordinate with external vendors and service providers as needed.'], 'Requirements': ['Proven experience as a Web Developer and Web Designer.', 'Proficiency in WordPress, Elementor, Microsoft tools, and GoDaddy hosting services.', 'Strong knowledge of HTML, CSS, JavaScript, and other relevant web design coding languages.', 'Experience with website security best practices and tools.', 'Ability to work independently and take charge of website management.', 'Excellent problem-solving skills and attention to detail.', 'Strong communication and teamwork skills.', 'Willingness to be on call during weekends for urgent website issues.', 'Ability to manage multiple projects and meet deadlines.'], 'Preferred Qualifications': ['Experience in the education or e-learning industry.', 'Knowledge of SEO and digital marketing principles.', 'Familiarity with e-commerce platforms and payment gateway integration.'], 'What We Offer': ['Competitive salary and benefits package.', 'Flexible working hours and remote work options.', 'Opportunities for professional development and growth.', 'A collaborative and supportive work environment.'], 'Benefits': ['Flexible schedule', 'Work from home'], 'Education': [""Bachelor's (Preferred)""]}"
e8c682be5f78e37c,TrooperCruit Pvt Ltd,apply through indeed,https://in.indeed.com/rc/clk?jk=e8c682be5f78e37c&bb=GFlvSWsW6chIpRj53B-qaD8kQq9aJ5uZekXgtOa9R07-0JlStqVs0eYKOBVN576F4EDuxDeyrm1z3E8ws8casBM8aNrzrKURBC5zcXnzhQLEfzLa59fcwuoBl60k9akR&xkcb=SoA967M39nzXaVQNiB1NbzkdCdPP&fccid=98cc06d7cc9cadc9&cmp=TrooperCruit-Pvt-Ltd&ti=Full+Stack+Developer&vjs=3,13/08/2024,Full Stack Developer (Intern),,"['Full-time', 'Internship']","['Day shift', 'Monday to Friday']",,,"{'Responsibilities': ['Work with the development team to design and implement web applications.', 'Write clean, efficient, and maintainable code using HTML, CSS, JavaScript, and other relevant technologies.', 'Participate in code reviews to ensure code quality and adherence to coding standards.', 'Collaborate with other teams, including design and quality assurance, to deliver high-quality web applications.', 'Continuously learn and improve your skills through on-the-job training and self-learning.', 'Work on assigned projects and deliverables within the set deadlines.', 'Troubleshoot and debug web applications to resolve issues.'], 'Requirements': ['A strong understanding of HTML, CSS, and JavaScript.', 'Knowledge of SQL and experience working with databases.', 'Experience working with MVC, jQuery, and WebAPI.', 'Good communication and teamwork skills.', 'Ability to work independently and take initiative.', 'Attention to detail and a focus on delivering quality work.', 'Availability to work full-time or part-time, depending on the internship program.'], 'Location Type': ['Remote'], 'Application Question(s)': ['Are you from Telangana and Andhra Pradesh?'], 'Education': [""Bachelor's (Preferred)""], 'Experience': ['Angular: 1 year (Preferred)', 'total work: 1 year (Preferred)', 'Java: 1 year (Preferred)']}"
062bba3459cff75a,DMX DIGITAL,apply through indeed,https://in.indeed.com/rc/clk?jk=062bba3459cff75a&bb=GFlvSWsW6chIpRj53B-qaLk8WFjV7Da7CyDdnw-Jx7eYr70Y-ry8Y5v7HCR92aX1brIPDN8retZKH61cWOeFOS5r0-m0_AXfHDEViEDqjbmF8gUZr0RkO_RpzkWD632V&xkcb=SoCJ67M39nzXaVQNiB1MbzkdCdPP&fccid=6c1166cf3f35df94&cmp=DMX-DIGITAL&ti=Wordpress+Developer&vjs=3,07/08/2024,PHP & Wordpress Developer,"₹18,000 - ₹20,000 a month",['Full-time'],"['Day shift', 'Monday to Friday']",Paid sick time,"Pune, Maharashtra","{'Benefits': ['Paid sick time'], 'Supplemental Pay': ['Performance bonus'], 'Ability to commute/relocate': ['Pune, Pune - 411047, Maharashtra: Reliably commute or planning to relocate before starting work (Preferred)'], 'Education': [""Bachelor's (Required)""], 'Experience': ['WordPress: 1 year (Required)'], 'Language': ['Marathi (Required)', 'English (Required)', 'Hindi (Required)']}"
dd6dab0f9eb65b14,Sapphire Infocom Pvt Ltd.,apply through indeed,https://in.indeed.com/rc/clk?jk=dd6dab0f9eb65b14&bb=GFlvSWsW6chIpRj53B-qaI0rJSaYK3gauj0Y4zJWYoUEDS9tGKtGnv0oy_kWfjHOasko9Wx5p80TPXsusIPeerwbtjrxs7eXoPaaqNYEelSLryDOUNvDXUM1jpRkWLQa&xkcb=SoBg67M39nzXaVQNiB1DbzkdCdPP&fccid=84973c5cb1c90c75&cmp=Sapphire-Infocom-Pvt-Ltd.&ti=Web+Developer&vjs=3,06/08/2024,Web Developer Intern,"From ₹5,000 a month","['Full-time', 'Permanent']",['Day shift'],Food provided,"Satellite, Ahmedabad, Gujarat","{'Job will sharpen your skills in ': ['asp .net', 'MVC Framework', 'C#', 'JSON', 'HTML', 'React JS', 'Node JS', 'SQL', 'Cloud applications', 'JavaScript', 'jQuery', 'JQuery UI', 'AJAX'], 'Work Remotel': ['No'], 'Benefits': ['Food provided', 'Leave encashment'], 'Supplemental Pay': ['Performance bonus', 'Yearly bonus'], 'Education': [""Bachelor's (Preferred)""], 'Experience': ['HTML5: 1 year (Preferred)']}"
93f15cffe6481e8f,ENTHU TECHNOLOGY SOLUTIONS INDIA PVT LTD,apply through indeed,https://in.indeed.com/rc/clk?jk=93f15cffe6481e8f&bb=GFlvSWsW6chIpRj53B-qaNtDHzD_SeNv3PDDPVIgJrV58FCQqGPdCQf0i8NUDNse2S0pubXHYz2ytYqZK90UTpn7KhXLILqpoV4FXJ1zNzhsK0BePxzMCwPw1BB5duRN&xkcb=SoDU67M39nzXaVQNiB1CbzkdCdPP&fccid=5bc3652253fc5018&cmp=Enthu-Technology-Solutions-India-Pvt-Ltd&ti=Web+Developer&vjs=3,11/08/2024,React Web Developer,"₹11,000 - ₹50,000 a month",['Full-time'],['Day shift'],Cell phone reimbursement,"Coimbatore, Tamil Nadu","{'Benefits': ['Cell phone reimbursement', 'Food provided', 'Health insurance', 'Paid sick time', 'Provident Fund'], 'Education': [""Bachelor's (Preferred)""], 'Experience': ['total work: 1 year (Preferred)', 'React: 1 year (Preferred)'], 'Willingness to travel': ['50% (Preferred)']}"
72534787015360b9,Intesols Private Limited,apply through indeed,https://in.indeed.com/rc/clk?jk=72534787015360b9&bb=GFlvSWsW6chIpRj53B-qaKbOPvI_0EYLzbKUnq6EAzAYeQpuWK9UWDOI6xibnElG2fuiWJlYLfMrNTnPUkLZj0Q9H6OZTzhwPQH6k9XauRtJcJJdYUYBfnQtFNXiiztg&xkcb=SoD967M39nzXaVQNiB1AbzkdCdPP&fccid=c21601747fe009ef&cmp=Intesols-P-Ltd&ti=Developer&vjs=3,11/08/2024,Trainee Developer - Fresher,"Up to ₹5,000 a month","['Full-time', 'Internship', 'Fresher']","['Morning shift', 'Fixed shift', 'Monday to Friday']",Paid sick time,"Ambawadi, Ahmedabad, Gujarat","{'We will provide': ['Freedom to apply innovative techniques', 'Transparent and supportive working culture', 'Platform to excel and grow', 'Leadership opportunity', 'Work / Life balance environment', '12 national and festival leaves', '06 sick leaves', '16 paid leaves.', 'Shift timings : 7:00 AM to 4:30 PM (Monday to Friday)'], 'Ability to commute/relocate': ['Ambawadi, Ahmedabad, Gujarat: Reliably commute or planning to relocate before starting work (Preferred)'], 'Application Question(s)': ['In which year you completed your IT graduation? or currently you are in last year of IT graduation?'], 'Education': [""Bachelor's (Preferred)""]}"
2f2d9b853048dd05,BOEING,https://in.indeed.com/applystart?jk=2f2d9b853048dd05&from=vj&pos=bottom&mvj=0&jobsearchTk=1i57tnbovkdrt873&spon=1&adid=424354245&xkcb=SoBm6_M39nzSpc29mR0KbzkdCdPP&xfps=f793ba95-a4cf-4f26-a5fa-4db9cd67d5b4&sjdu=QWF4TUFyrHvH7u082A4fawHvUwpaBgl-ai54qKLVhAM&vjfrom=vjs&asub=mob&astse=53cafa51da33cae0&assa=391,https://in.indeed.com/pagead/clk?mo=r&ad=-6NYlbfkN0BddK4H-tsabPiX3BvkwhvbvP4OkLNzlRX6egXJy9Hb12oL2JVotgvbkYnDIolponc9DvlT-Obuekjj_l3pCtOirlvoN_V3A1J0D3kc0BDLYMRxARCGbmwInFYnYTjy6wVHqPfzkz3WbR9DZHyK16buu2op_2dw9jisooNYJTi3McUOeBb_YTaDXCgZiEIAiGoZnwqvF_xmL6kQ-pfFOFOsxndfjcLI_U8cOu23QWZfCdXz4fv-WCVH2oAqJMBNfL78nqVDMRAAA-xQsR1nk0zMU7zyjOX7pSdEmSgy_PRfoikiy1Ha5aFxMMNDWoAecFg2RpOLMRp539ipX1IGLGmEwuc4IvFrPFZGvZxnnGbiaa2T9htiw71m4EclLsP0FS3s30_5iMOo_M1ck7jD3wF6d9g_K1lMmadsJxOz7Uf-ZGVw8BiF5TaYBBCNkDHGokW1H07zWVbXP0GZVuKqQfuATvmNKESojUgWgem616pDkFIJNEWJSPBGs72Q_Yw7JYP8akZHSHcKawCrOJynTq_-WZwWpdBvfp-rMxhqiwp04cyT9dS-oNeqyKDtGiADKxr4JvHW8LO9CnPbHNU99Z6JBaxd49Xs-z3iPF9CBbAD8-2P7PP3I5FoGvhZdFhCMeo0M4bJF_6DWTety66PLXwcv1mCoOOwLXXPB4BcZqqA4M_M1JuIJX_k6cAo_5zbpseRkEEseA3_CB1Zp_G6buA0WOD3qZoD8DjZT6_TqjGYjm6BX4pdqz9T2dnAL-0J7w26jPtkcRI19Jxe2tIOnlONNdRXcSnTeZY=&xkcb=SoBm6_M39nzSpc29mR0KbzkdCdPP&camk=4HOcmqOLYrAflQ1eWdDutQ==&p=1&fvj=0&vjs=3,10/08/2024,Associate Programmer Analyst - Java Full Stack,,[],[],,"Bengaluru, Karnataka",{}
96d6e78c19345da1,Vmoksha Technologies Pvt. Ltd,apply through indeed,https://in.indeed.com/rc/clk?jk=96d6e78c19345da1&bb=vnP5pWkk0ifdIJ7SoijWVphzOsqDHiBAaCay9FNviPADsxd8A-EsJNPQuFW_HWdsdynkXn4qYBKe4wIdU8BmvyMFufsQV2-qfnPdwlSBm-MW6rdWfm30bY9eGxO4gKCc&xkcb=SoAP67M39nzSpc29mR0JbzkdCdPP&fccid=fc25c71bd02663ef&cmp=Vmoksha-Technologies-Pvt.-Ltd&ti=Wordpress+Developer&vjs=3,10/08/2024,Wordpress Developer,"₹10,663.54 - ₹43,650.44 a month",['Permanent'],[],Work from home,,"{'Key Responsibilities': ['Plugin Development:', 'Develop, customize, and maintain WordPress plugins to enhance website functionality.', 'Ensure all plugins are optimized for performance and security.', 'Website Management:', 'Provide expert guidance on managing websites with high traffic, ranging from 100,000 to 200,000 visitors per month.', 'Offer solutions to optimize website speed and performance, ensuring seamless user experience.', 'Troubleshooting:', 'Diagnose and resolve complex issues that arise within the WordPress ecosystem.', 'Collaborate with the in-house development team to address and fix bugs or errors promptly.', 'AWS Services:', 'Leverage Amazon Web Services (AWS) for hosting and managing website environments.', 'Implement best practices for cloud-based solutions to ensure scalability, reliability, and security.', 'Consulting & Guidance:', 'Act as a consultant to the in-house development team, providing insights on application scaling and best practices.', 'Assist in planning and implementing strategies for long-term growth and scalability of web applications.', 'Performance Optimization:', 'Identify bottlenecks and guide the internal WordPress developer in implementing strategies to improve page load times and overall site performance.', 'Guide the internal wordpress developer and Conduct regular audits to ensure the website remains optimized and efficient.'], 'Qualifications': ['10+ years of experience in WordPress development with a strong focus on plugin development and customization.', 'Proven experience in managing and optimizing high-traffic websites (100,000 to 200,000 visitors per month).', 'Extensive knowledge of AWS services and hosting environments.', 'Strong troubleshooting skills with the ability to diagnose and resolve complex WordPress issues.', 'Experience in performance optimization, including caching, CDN integration, and image optimization.', 'Ability to work collaboratively with an in-house development team and provide expert guidance.', 'Preferred Skills:', 'Experience with modern development practices and tools (e.g., Git, Docker).', 'Knowledge of front-end technologies (HTML, CSS, JavaScript) and responsive design principles.', 'Familiarity with SEO best practices and tools for website optimization.'], 'Benefits': ['Work from home'], 'Education': [""Bachelor's (Preferred)""], 'Experience': ['WordPress: 10 years (Required)', 'AWS: 4 years (Required)']}"
7e497d285c8f3bbe,ATOM AVIATION SERVICES PRIVATE LIMITED,apply through indeed,https://in.indeed.com/rc/clk?jk=7e497d285c8f3bbe&bb=vnP5pWkk0ifdIJ7SoijWVtrBhKLBr7HSefJx24ZqS78sFTVgaiHm7xPTII1dKETAifZihO1zoFJVnbq0raeXwyumYPoLW0O1IHc0wu7biQWAL7cUd43qfeHaIZ0wOcBW&xkcb=SoA167M39nzSpc29mR0PbzkdCdPP&fccid=7509e4e9ff820ef8&cmp=Atom-Aviation-Services-Private-Limited&ti=Web+Designer&vjs=3,14/08/2024,Web Designer/Developer,"₹20,000 - ₹34,000 a month","['Full-time', 'Permanent']","['Morning shift', 'Day shift']",,"Delhi, Delhi","{'Key Responsibilities': ['Design visually appealing websites: Create aesthetically pleasing and user-friendly designs that align with the brand identity and enhance the user experience.', 'Develop wireframes, prototypes, and mockups: Use design tools to create site layout/user interface from concept to final hand-off to engineering.', 'Collaborate with cross-functional teams: Work closely with developers, content creators, and marketing teams to ensure designs are functional and meet technical requirements.', 'Ensure website responsiveness: Design websites that are responsive and optimized for different devices and screen sizes.', 'Implement design elements: Use HTML, CSS, and other web technologies to translate designs into functional websites.', 'Optimize websites for speed and performance: Ensure that websites load efficiently and are optimized for search engines (SEO).', 'Stay up-to-date with design trends and technologies: Keep abreast of the latest trends in web design, user experience, and web development technologies.', 'Review and revise designs based on feedback: Adjust designs according to client and team feedback to achieve the desired final product.'], 'Supplemental Pay': ['Performance bonus', 'Yearly bonus'], 'Education': [""Bachelor's (Preferred)""], 'Experience': ['PHP: 1 year (Preferred)', 'web design: 1 year (Preferred)', 'total work: 1 year (Preferred)', 'WordPress: 1 year (Preferred)']}"
d2e93d6752ce7138,Grocito Online Private Limited,apply through indeed,https://in.indeed.com/rc/clk?jk=d2e93d6752ce7138&bb=vnP5pWkk0ifdIJ7SoijWVmRHPD2dzE3iw8SI1JdgrhjvIU0nJMuxIgykFz0yvolldkp7qGXO-eG3Ht77oUb9Tw8Gq4bnZwAAmFpAadPE3YEMenGwMy3l5e0Tx4XEJr_U&xkcb=SoCB67M39nzSpc29mR0ObzkdCdPP&fccid=7e804079c1fd6f86&cmp=Grocito-Online-Private-Limited&ti=Web+Developer&vjs=3,11/08/2024,Web Developer,"₹8,000 - ₹12,000 a month","['Full-time', 'Permanent']",['Day shift'],Work from home,,"{'Benefits': ['Work from home'], 'Supplemental Pay': ['Performance bonus', 'Yearly bonus'], 'Experience': ['total work: 1 year (Preferred)', 'HTML5: 1 year (Preferred)', 'Web development: 1 year (Preferred)']}"
91c8f5e93123bd64,Coozmoo Digital Solutions,apply through indeed,https://in.indeed.com/rc/clk?jk=91c8f5e93123bd64&bb=vnP5pWkk0ifdIJ7SoijWVjJIV8RZuko9-3IkytNtmLrubO_rnjegr0b49UojuaErtZBYoQh2JkV_JFxrUTDmgZl6e-jtgUIKOGtUPoJY-XR3m0MVQpw6wHOmHkXXhefZ&xkcb=SoAc67M39nzSpc29mR0NbzkdCdPP&fccid=ba7d480c1a7925bd&cmp=Coozmoo-Digital-Marketing&ti=Front+End+Developer&vjs=3,10/08/2024,Front End Web Developer,"₹12,751.91 - ₹22,000.00 a month","['Full-time', 'Fresher', 'Permanent']","['Night shift', 'US shift', 'Monday to Friday']",Commuter assistance,"Chopasni Housing Board, Jodhpur, Rajasthan","{'Benefits': ['Commuter assistance', 'Health insurance', 'Paid sick time', 'Provident Fund'], 'Supplemental Pay': ['Overtime pay', 'Shift allowance', 'Yearly bonus'], 'Ability to commute/relocate': ['Chopasni Housing Board, Jodhpur, Rajasthan: Reliably commute or planning to relocate before starting work (Required)'], 'Education': ['Higher Secondary(12th Pass) (Required)'], 'Experience': ['Angular: 1 year (Preferred)', 'total work: 1 year (Preferred)', 'HTML5: 1 year (Required)'], 'Location': ['Chopasni Housing Board, Jodhpur, Rajasthan (Required)'], 'Shift availability': ['Night Shift (Preferred)']}"
e298b99f3776cf17,YUNG DIGITAL MEDIA INDIA PRIVATE LIMITED,apply through indeed,https://in.indeed.com/rc/clk?jk=e298b99f3776cf17&bb=vnP5pWkk0ifdIJ7SoijWVuc3YxiCEUBAwdmYSODkcizmLIz_2sBf2Wc10CToLB3wMtpurlYXtL1yAoCWD4jmGY4xdJj5by4yNAEnW9dpwaI-I87ZFdeBdVJk20YNR9im&xkcb=SoBB67M39nzSpc29mR0DbzkdCdPP&fccid=c67c15757355dcc1&cmp=YUNG-DIGITAL-MEDIA-INDIA-PRIVATE-LIMITED&ti=Front+End+Developer&vjs=3,11/08/2024,Front End Developer Intern (Fresher),,"['Full-time', 'Internship']","['Day shift', 'Monday to Friday']",,"Velachery, Chennai, Tamil Nadu","{'Only those students or freshers can apply who': ['Are available for a full time (in-office) internship', 'Have relevant skills and interests', 'Are available for a duration of 3 months', 'Have already graduated or are currently in any year of study', 'Who are willing to start/restart their career may also apply'], 'Education': [""Bachelor's (Preferred)""], 'Experience': ['Angular: 1 year (Preferred)', 'total work: 1 year (Preferred)', 'HTML5: 1 year (Preferred)'], 'License/Certification': ['Magneto (Preferred)']}"
