job_id,company,apply_link,job_link,job_posted,title,salary,job_type,shift_schedule,benefits,location,description
eee4fd89e319c90f,Coreway Solution,apply through indeed,https://in.indeed.com/rc/clk?jk=eee4fd89e319c90f&bb=FB2WnNOowVxBUEvPu51MjmGMwNq3BmaakozgAOzWpsXAf9D77Cr-Gr4vsfpXBcY74_d-udmeg8yRSST7OBQKdWHVZZH5kR7KzHz_mKEFurWARmbhVwF-huZmNWJfWBqN&xkcb=SoCF67M39n1W8LTm3J0PbzkdCdPP&fccid=0d1bdf6d358dccd2&cmp=Coreway-Solution&ti=PHP+Intern&vjs=3,09/08/2024,PHP Intern,"Up to ₹12,000 a month","['Full-time', 'Internship', 'Fresher']","['Day shift', 'Fixed shift', 'Monday to Friday']",Flexible schedule,"Nikol, Ahmedabad, Gujarat","{'Responsibilities': ['Assist in the development, testing, and maintenance of web applications using PHP.', 'Collaborate with senior developers and team members on various projects.', 'Write clean, well-documented, and efficient code.', 'Participate in code reviews and contribute to the team’s knowledge base.', 'Troubleshoot and debug issues as they arise.', 'Stay updated with the latest industry trends and technologies.'], 'Requirements': ['Basic understanding of PHP and web development principles.', 'Familiarity with HTML, CSS, JavaScript, and MySQL.', 'Eagerness to learn and adapt to new technologies and frameworks.', 'Strong problem-solving skills and attention to detail.', 'Good communication and teamwork abilities.', 'Prior experience with Laravel, Magento, or Shopify is a plus but not required.'], 'Benefits': ['Flexible schedule'], 'Supplemental Pay': ['Yearly bonus'], 'Application Question(s)': ['we are looking for interns or freshers only. there will be 3 months of training before the stipend/salary starts. are you comfortable to apply for this job?']}"
e8364f28cc9ee568,Hilt Web Solutions Pvt Ltd.,apply through indeed,https://in.indeed.com/rc/clk?jk=e8364f28cc9ee568&bb=FB2WnNOowVxBUEvPu51MjhGkC7056RjDP0sG7zjBXYEvZskotW6_AGQaTNDQwv3EZKJGAfcn6O0zf9aMHF7QKiLngwIM-3dTbAsL914H9S3HQMVNVoryRuu3PjPM6Iv2&xkcb=SoAx67M39n1W8LTm3J0ObzkdCdPP&fccid=25a2f91439aacb82&cmp=Hilt-Web-Solutions&ti=PHP+Developer&vjs=3,13/08/2024,PHP Developer(Fresher),"₹7,000 - ₹15,000 a month","['Full-time', 'Permanent']","['Morning shift', 'Day shift', 'Monday to Friday']",Paid time off,"Mohali, Punjab","{'Benefits': ['Paid time off'], 'Location Type': ['In-person']}"
0baf77223b6b9166,Qurinom Solutions,apply through indeed,https://in.indeed.com/rc/clk?jk=0baf77223b6b9166&bb=FB2WnNOowVxBUEvPu51Mjqt6WjAkjbnF20dlRVvmIbLR6JXnOxlCgSRECtdUaWgTcnOJnpGm9_AzgmLwtgLEOBFb85ux-wMkFBGV4Vl559vudtz0iVP6IsdpmGmfCwUv&xkcb=SoCs67M39n1W8LTm3J0NbzkdCdPP&fccid=77b7b8a2d364a912&cmp=Qurinom-Solutions&ti=Full+Stack+Developer&vjs=3,12/08/2024,Full Stack Developer,"₹3,00,000 - ₹5,50,000 a year",['Full-time'],"['Day shift', 'Monday to Friday']",Provident Fund,,"{'Responsibilities': [""You will work with a team of world-class developers on technologies that people won't be able to live without Algorithms, JavaScript with Node.js, APIs, and React.js."", 'Minimum of 01 - 2 years of experience required in full stack development, especially on react.js in the frontend and node.js in the backend with MongoDB as a database.', 'You must also collaborate across multidisciplinary teams such as architecture, project management, infrastructure operations, and system users.', 'Our areas of expertise are within Retail, e-commerce, IoT, Cloud, Mobile, and Web where do you find yourself in the future?', 'Key skills: Must be good in both front and back end.', 'Back end: Node.js and Express, APIs, MongoDB, JSON, RESTful APIs, PostgreSQL, etc.', 'Front end: React.js, jQuery, Bootstrap, HTML, CSS, JavaScript.', 'As a Full Stack Developer, you will be responsible for the end-to-end phases of the software development lifecycle including technical research, requirements analysis, high-level, and technical design, improving user experience, shaping the face of our new products, building internal tools, implementation of enhancements to the product, unit testing, debugging, and maintenance.', 'Should have great interpersonal and communication skills.'], 'WHAT We d': ['We build large-scale applications over mobility over AI, Image processing, ML, and NLP and also serve hedge clients across Asia, Africa helping our clients with cutting-edge services like Digital transformation, IT Consulting, UX/UI Modernization, Mobile App Development, Cloud modernization, Embedded Systems, IoT & Blockchain.'], 'WHY Join US': ['Creating an Employee friendly environment is our assurance.', 'Your growth and development, excelling in your career is our responsibility.', 'A Remote working facility provides you to focus better to stay safe with your family.'], 'WHO ARE WE': ['We are extremely delighted to introduce our successful Start-up. We Qurinom Solutions, offer you the best assistance for your business in information technology. Our multifaceted team of highly qualified and experienced people from diverse professional fields assures you of superior quality of Products & services in almost every domain. Precision and punctuality towards services are our forte. We are obliged to serve clients'], 'Benefits': ['Provident Fund'], 'Supplemental Pay': ['Yearly bonus'], 'Ability to commute/relocate': ['hyderbad, Telangana: Reliably commute or planning to relocate before starting work (Required)'], 'Education': [""Bachelor's (Preferred)""], 'Experience': ['MERN: 1 year (Required)']}"
d2386e33a3b66189,Abiding Technology,apply through indeed,https://in.indeed.com/rc/clk?jk=d2386e33a3b66189&bb=FB2WnNOowVxBUEvPu51Mjm3O5rFZwNDU0o_rasuu0TGGgTeI78St9aHqYEqYAGKcpwgUhIM91SSLTWJqPOxyJlhp-1sSRuhfR6bXbeebG3UH04HaWdx0dXBtTybgkV9R&xkcb=SoAY67M39n1W8LTm3J0MbzkdCdPP&fccid=b3f4548246397789&cmp=Abiding-Technology&ti=Web+Developer&vjs=3,10/08/2024,Web Developer,"₹9,053.75 - ₹30,000.00 a month","['Full-time', 'Part-time', 'Fresher', 'Permanent']","['Day shift', 'Fixed shift']",,"Chennai, Tamil Nadu","{'Education': [""Bachelor's (Preferred)""], 'Experience': ['CSS: 1 year (Preferred)', 'total work: 1 year (Preferred)', 'HTML5: 1 year (Preferred)']}"
9f36ecc12276e3a8,sudesh kumar and company,apply through indeed,https://in.indeed.com/rc/clk?jk=9f36ecc12276e3a8&bb=FB2WnNOowVxBUEvPu51MjocC6Bqiuz4qdmnQ-xhHVIRyeSeuCZs6QzJrJP949T_3S0T-xIAcp2WxlFss0Qg-Q61bv8tXvgtTUf8zCJ34284EsfzySKBGCAMJjIWgtugT&xkcb=SoDx67M39n1W8LTm3J0DbzkdCdPP&fccid=a3c0454320a4b0d2&cmp=sudesh-kumar-and-company&ti=Web+Developer&vjs=3,11/08/2024,Web Developer,"₹8,000 - ₹15,000 a month","['Full-time', 'Permanent']",['Day shift'],,"Peeragarhi, Delhi, Delhi","{'Education': [""Bachelor's (Preferred)""], 'Experience': ['CSS: 1 year (Required)', 'total work: 1 year (Required)', 'HTML5: 1 year (Required)']}"
ff1b4f48b065e309,HTML My Design,https://in.indeed.com/applystart?jk=ff1b4f48b065e309&from=vj&pos=bottom&mvj=0&jobsearchTk=1i57um96njhr386b&spon=0&xkcb=SoBF67M39n1W8LTm3J0CbzkdCdPP&xfps=a40349f8-9657-4ebe-8604-09bbca4472f2&sjdu=9ZgGHApWFNhYVuSb4MNDAMazpvQg3cD5E4-qe79Qn3s0Nm_SJd9fWSAsMFSKnXIb&vjfrom=vjs&asub=mob&astse=60352f53f1f78a0a&assa=7449,https://in.indeed.com/rc/clk?jk=ff1b4f48b065e309&bb=FB2WnNOowVxBUEvPu51MjskADjw4DVpoiRZazRFGRB4f9ogSchCShwoW5dJiwRHVG58mzYpbJDVauWd-luv6BYTZ2e9ORjjB2kXURlrJIFVI5Np_-a59b_EjIrATzkWp&xkcb=SoBF67M39n1W8LTm3J0CbzkdCdPP&fccid=74a16b8f834b630e&vjs=3,11/08/2024,Back-End web developer,,[],[],Flexible schedule,"Delhi, Delhi",{}
6610f388a69dc3b8,LIVEPRO ACESOFT,apply through indeed,https://in.indeed.com/rc/clk?jk=6610f388a69dc3b8&bb=FB2WnNOowVxBUEvPu51MjpPGbwzKlLdDLsNer-9MOGwN9VMq8XO2pPxqtRVCq5VrqBNLAKInNg-TgimFcCtlRIfyJYs-jDvVCV3exCnrBWC6q-_WEP6iYAeqRJ_Ck1PW&xkcb=SoDY67M39n1W8LTm3J0BbzkdCdPP&fccid=e33ea2197ee1a0ed&cmp=Meditree-Solutions-PVT-LTD&ti=Software+Engineer&vjs=3,10/08/2024,Software Developer Intern,"From ₹6,000 a month",['Full-time'],['Night shift'],Work from home,"Kollam, Kerala","{'Location Type': ['In-person'], 'Education': [""Bachelor's (Preferred)""]}"
276048cdaf45e2eb,Intelsat,https://in.indeed.com/applystart?jk=276048cdaf45e2eb&from=vj&pos=bottom&mvj=0&jobsearchTk=1i57um96njhr386b&spon=0&xkcb=SoBs67M39n1W8LTm3J0AbzkdCdPP&xfps=9a84293f-196e-42e2-83ab-6761d498727a&sjdu=BQ1fOKU6SMjz57AxXCzG64DDplm6SwWjHcxyoDIphKnna7Gq9Qo9A1mNI4s3Fslzt-lQoreB6eF9Di1AP7FegCSzdAKCTTOXH7BC5lQd78ZuwkhWyT0ZETPSNvvxtHPFZDQ-5ILx2yv5sIwaULhbu3c3ngFBFG1C13fvr-V_Y1KdIMWXb7RpkcAVHCQBQT8_w9_XINGINv7OnqX9-Wv1cg&vjfrom=vjs&asub=mob&astse=abd3649c2ccc2fdc&assa=1159,https://in.indeed.com/rc/clk?jk=276048cdaf45e2eb&bb=FB2WnNOowVxBUEvPu51Mjv3fmXcyXbj-wUPd6XxB4_4SDkJ0kTK2-nVr7qkaOlZKV-W8xDvMdS2cqeGBv0szlAJcqYif7lgHU5FcAlnjmUFNYSgQhZ0bgw%3D%3D&xkcb=SoBs67M39n1W8LTm3J0AbzkdCdPP&fccid=36aa8cd93a88392d&vjs=3,13/08/2024,"Intern, Associate Software Engineer",,['Full-time'],[],Health insurance,,"{'What you will d': ['Primarily responsible for the Airborne System Software design and development.', 'Work with the Architects/ Technical lead / Product Owner to understand user requirements, convert BDD scenarios or user stories into product functionality.', 'Work with the team members collectively to own and deliver features and flexible to take up any type of tasks like develop, automate and test to complete feature.', 'Perform engineering quality checks clearly and consistently.'], 'Your required experience/skill': ['Master’s or bachelor’s degree in computer science, electronics engineering or related technology – advanced degree preferred', 'Good development experience with Java / C++ / Go / Java / ReactJS', 'Good knowledge on OOPs and Data structures', 'Knowledge of IP networking protocols and technologies', 'Ability to work under pressure, prioritize work, coordinate with onsite stakeholders and well organized.', 'Flexibility in working with technologies and platforms.', 'A commitment to excellence, best practices, and the continuous improvement of our products, code base, processes, and tools.'], 'Your success in this role will look like': ['Customer Focus', 'Winning as a Team through Collaboration', 'Courage and Accountability', 'Effective verbal and written communication skills', 'Agile Decision Making'], 'It would be nice if you had': ['Polyglot programming experience is preferred.', 'Virtualization, containerization (VirtualBox, Docker, KVM), Microservice architecture and event-driven system design knowledge would be a big plus.', 'Knowledge of Continuous Integration and Test Automation methodology Knowledge in CI/CD and AWS deployments (EC2, Lambda, S3, MySQL) is a plus.'], 'How we support you': ['Hybrid work environment offering up to two days per week work from home (for eligible positions)', 'Development opportunities supporting professional growth championed by our dedicated Learning & Development team. 20-25% of our positions are hired internally!', 'Ways to get involved: satellite launch parties, company connect events, charitable activities, team social events, recognition programs, and employee resource groups.']}"
d143749d149bd787,Youth Dreamers Foundation,apply through indeed,https://in.indeed.com/rc/clk?jk=d143749d149bd787&bb=FB2WnNOowVxBUEvPu51Mjq2m_ffDQI8v3cfK8CnIZQPkKwdwBRiWqHwNif8UZUsyrWTXot2Wp8yvO3f6sqDYXPHwBz4za2NWdYvAwVOMrXN5CgNl9iwUN117kUteVFAi&xkcb=SoDi67M39n1W8LTm3J0HbzkdCdPP&fccid=8ba2a35dbb8d0e90&cmp=Youth-Dreamers-Foundation&ti=Development+Operations+Engineer&vjs=3,09/08/2024,Program Associate – Dev Ops,"₹24,000 - ₹28,000 a month",['Full-time'],['Day shift'],Cell phone reimbursement,,"{'The Sysadmin Associate will work with': ['Scholars & other beneficiaries: to learn from feedback about self-service applications', 'Operations Teams:to enable seamless delivery & monitoring of scholar services', 'Data-ops lead: to integrate operational data with BI', 'Tech Lead: to integrate relevant services and tools', 'Open Source Communities: to collaborate with members for deploying new software'], 'Overvie': ['Job Type: Full-time; contract to be renewed annually', 'Salary: ₹ 25,000 - ₹ 28,000 per month, commensurate with experience and expertise', 'Reporting To: Tech Lead', 'Location:', 'YDF Office, if working from: Delhi / Patna (Bihar) / Nashik (Maharashtra) / Behror (Rajasthan) / Dera Bassi (Punjab)', 'Remote, if working from any other place', 'Travel: Rare, for organizational meetings & workshops'], 'Self-learnin': ['Keeps up-to-date with official information of private & government scholarship schemes', 'Masters web development best practices through online certifications', 'Explore and test various tech tools and services to integrate with operations'], 'Maintain tech asset': ['Maintains codebase on YDF gitlab repo', 'Maintains regular backups of all the services and tech tools', 'Leads testing & deployment of new versions / features for web-services and mobile apps', 'Manages the tech stack spread over multiple services - digitalocean, hostinger, godaddy'], 'Ensure Security & Data Privac': ['Monitors & fixes uptime', 'Sets up & maintains firewalls, authentication services,', 'Conducts data audits, ensures data privacy policies'], 'Internal capacity buildin': ['Conducts orientation sessions for the team over new services and tools deployed', 'Regularly conducts capacity building workshops and sessions for the team'], 'Desired Profil': ['First preference is for candidates with proven experience in the key responsibility areas (regardless of educational qualifications)', 'Women & candidates from disadvantaged backgrounds are strongly encouraged to apply', 'Skills: (as per the following minimum specifications, with a willingness to learn the rest)', 'At least 3 of: docker, flutter, node.js (or equivalent) Android, selenium or puppeteer', 'At least 2 of: moodle, wordpress, digitalocean / linode', 'At least 1 of: git, APIs, access control, authentication (SAML / SSO / MFA)', 'At least 1 of: python, java, php', 'Education: BE/BTech, Graduate degree/diploma in IT, Computer Applications or any other equivalent technical degree (candidates with exceptional web development skills but having other degrees may also be considered)', 'Proven ability to independently handle diverse assignments simultaneously, self-assign tasks and collaborate with others to meet deadlines with high-quality work', 'Excellent verbal & written communication'], 'Benefits': ['Cell phone reimbursement', 'Health insurance']}"
d152e8d19cbbf281,EXQUISITE GOLDFINCH LLP,apply through indeed,https://in.indeed.com/rc/clk?jk=d152e8d19cbbf281&bb=FB2WnNOowVxBUEvPu51MjjUCl3JVWJA8fxkvp1OgGrawpIBUEBB3e3rYK408SoklzaBJtnL0QfD7fkBfXlQcPaYqYR2wkun70c7YYinrPD_-TXd90IL-vgx-JNOMkCxA&xkcb=SoBW67M39n1W8LTm3J0GbzkdCdPP&fccid=222d1c73a65ac83f&cmp=EXQUISITE-GOLDFINCH-LLP&ti=Web+Developer&vjs=3,05/08/2024,Website Developer,"₹10,000 - ₹20,000 a month",['Full-time'],['Day shift'],,"Noida, Uttar Pradesh","{'Education': ['Diploma (Preferred)'], 'Experience': ['CSS: 2 years (Preferred)', 'total work: 2 years (Preferred)', 'HTML5: 2 years (Preferred)', 'Website Management: 2 years (Preferred)']}"
d726c0a6e9d66ab2,Passionate Futurist Solutions Pvt. Ltd.,apply through indeed,https://in.indeed.com/rc/clk?jk=d726c0a6e9d66ab2&bb=FB2WnNOowVxBUEvPu51Mji2EDg_fhIvyg5Rp1j6ZlZk8ot0oXEC6bEFQe5ku480nO2qDS1WFA0Q-hmzZtzEGuemDu61g-BLkXL85oYGrO_cEb4XBLuBA9YLM2Aep5L-P&xkcb=SoDL67M39n1W8LTm3J0FbzkdCdPP&fccid=80effdfdce773cfe&cmp=Passionate-Futurist&ti=Web+Developer&vjs=3,02/08/2024,Freshers Web Developer (Laravel),"₹9,000 - ₹25,000 a month","['Full-time', 'Fresher', 'Permanent']","['Day shift', 'Fixed shift', 'Monday to Friday']",Paid sick time,"New Town, Kolkata, West Bengal","{'Benefits': ['Paid sick time', 'Paid time off'], 'Location Type': ['In-person'], 'Education': [""Bachelor's (Preferred)""], 'Experience': ['Laravel: 1 year (Required)', 'total work: 1 year (Preferred)', 'HTML5: 1 year (Preferred)']}"
3f76a9e9a17e4a56,Codegene Technologies PVT LTD,apply through indeed,https://in.indeed.com/rc/clk?jk=3f76a9e9a17e4a56&bb=gcPkqhtAcrHzwQoLjVh5CErtTxjheCVvivgOYffZNVDoaa8KeN_WArTWbUFrfQQnNtdeMeAeRPac5EsDvpHGahv6IvXVpyWhHfO85b9syIK1veO-VDfYdAJBUX3pdmOP&xkcb=SoBQ67M39n1RBi23ah0LbzkdCdPP&fccid=59a623b3505f303d&cmp=Codegene-Technologies-PVT-LTD&ti=Developer&vjs=3,09/08/2024,React JS Developer,"₹2,00,000 - ₹6,00,000 a year",['Full-time'],[],,"Vijayawada, Andhra Pradesh","{'Responsibilities': ['Develop new user-facing features using React.js', 'Build reusable components and front-end libraries for future use', 'Translate designs and wireframes into high-quality code', 'Optimize components for maximum performance across a vast array of web-capable devices and browsers', 'Collaborate with other team members and stakeholders to deliver high-quality software solutions', 'Stay up-to-date with the latest industry trends and technologies to ensure our applications are cutting-edge'], 'Requirements': ['Proven experience as a React.js Developer', 'Strong proficiency in JavaScript', 'Thorough understanding of React.js and its core principles', 'Experience with popular React.js workflows (such as Redux)', 'Familiarity with RESTful APIs', 'Knowledge of modern authorization mechanisms, such as JSON Web Token', 'Familiarity with modern front-end build pipelines and tools', 'Experience with common front-end development tools, such as Babel, Webpack, NPM, etc.', 'A keen eye for UI/UX design and attention to detail', 'Excellent problem-solving and communication skills'], 'Education': [""Bachelor's (Preferred)""], 'Experience': ['total work: 1 year (Preferred)']}"
7d1cf755c41d9ab6,Cavintek Software Private Limited,apply through indeed,https://in.indeed.com/rc/clk?jk=7d1cf755c41d9ab6&bb=gcPkqhtAcrHzwQoLjVh5CEH70TSKp-K0fQUkSkRdtpsl-8xoIqYs8uV8r8QPSZNe2U4o1JobcE01FYyHQZYZ0IU5nGsd82km-c9JUIthOWicNGMTvFPgvaKEjj3YJbyt&xkcb=SoDk67M39n1RBi23ah0KbzkdCdPP&fccid=3963ade071b7146a&cmp=Cavintek-Software-Private-Limited&ti=Mobile+Developer&vjs=3,13/08/2024,Mobile Application Developer,"₹3,00,000 - ₹5,00,000 a year","['Full-time', 'Permanent']","['Day shift', 'Monday to Friday']",Health insurance,"Velachery, Chennai, Tamil Nadu","{'Responsibilities and Duties': ['Develop cross-platform mobile application by using C#.net and Xamarin/MAUI for both Android and iOS.', 'Plan, Design, Develop, Test, Deploy and Monitors cross-platform mobile apps.', 'Writes high-quality code for the mobile application and rich user experiences.', 'Testing the product in controlled, real situations before going live.', 'Work on bug fixing and improving application performance.', 'Play a lead role in evaluating new mobile technologies and develop plans for their implementation.', 'Continuously discover, evaluate, and implement new technologies to maximize development efficiency.'], 'Qualifications and Skill': ['1 to 2 years of experience as Mobile Application Developer required.', 'Strong knowledge of Native & Cross-platform application development on Xamarin forms/MAUI (Mandatory).', 'Experience using XAML for UI designs.', 'Knowledge in Dot Netcore will be added advantage.', 'Good knowledge of UI design principles (Android and iOS).', 'Good knowledge of concepts like Resources, Markup extensions, dependency properties, Databinding, and Commands.', 'Excellent knowledge of C#, .Net Framework, Object-oriented programming concepts, and LINQ.', 'Experience in Integrating web services developed in SOAP/ Web API / WCF (Web services) with UI.'], 'Benefits': ['Health insurance'], 'Supplemental Pay': ['Yearly bonus'], 'Education': [""Bachelor's (Preferred)""], 'Experience': ['Xamarin: 1 year (Preferred)', 'Mobile applications: 1 year (Preferred)']}"
ef70ea3504e8ff8e,Sobonix,apply through indeed,https://in.indeed.com/rc/clk?jk=ef70ea3504e8ff8e&bb=gcPkqhtAcrHzwQoLjVh5CBYioqd6t-2jiHbUq9kkiyluAj6nEbKp8QXtkGIWXJy1frA72ZbCWoO4fEm3vTKDCU8ltm8lASbPdHrenolKlx5viOCBrn58855-GEq274KR&xkcb=SoB567M39n1RBi23ah0JbzkdCdPP&fccid=dd751a8843385e41&cmp=SOBONIX-SOLUTIONS-PRIVATE-LIMITED&ti=Developer&vjs=3,09/08/2024,ROR + ReactJS Developer,"₹4,00,000 - ₹5,50,000 a year","['Full-time', 'Permanent']","['Day shift', 'Monday to Friday']",Flexible schedule,,"{'Requirements': ['2+ years of professional experience with Ruby on Rails and ReactJS.', 'Strong understanding of object-oriented programming and design patterns.', 'Experience with front-end technologies such as HTML5, CSS3, JavaScript, and modern JavaScript frameworks.', 'Familiarity with concepts of MVC, Mocking, ORM, and RESTful.', 'Solid understanding of database systems, particularly PostgreSQL or MySQL.', 'Experience with version control systems, such as Git.', 'Familiarity with continuous integration and deployment (CI/CD) pipelines.', 'Strong problem-solving skills and the ability to work independently or in a team.', 'Excellent communication skills, both verbal and written.'], 'What We Offer': ['Competitive salary and benefits package.', 'Opportunities for professional growth and development.', 'Flexible working hours and remote work options.', 'Collaborative and inclusive work environment.', 'Chance to work on innovative and exciting projects.'], 'Benefits': ['Paid sick time', 'Paid time off'], 'Education': [""Bachelor's (Preferred)""], 'Experience': ['total work: 2 years (Preferred)', 'Ruby on Rails: 2 years (Preferred)', 'React: 2 years (Preferred)']}"
b7ac7431da850625,Gleam Softech Private Limited,apply through indeed,https://in.indeed.com/rc/clk?jk=b7ac7431da850625&bb=gcPkqhtAcrHzwQoLjVh5CBYioqd6t-2jxIW9kgJ8ws4da66g60U4MXxMWb4B1g1ZnUEv6Pud1IRLK_lDV6H0XMxkNPfeK1ZOG652xgK3IH90FhUkvmq6mQDGtFSZYLke&xkcb=SoDN67M39n1RBi23ah0IbzkdCdPP&fccid=71d97cc777631756&cmp=Gleam-Softech-Private-Limited&ti=PHP+Developer&vjs=3,10/08/2024,PHP Web Developer,"₹12,706.32 - ₹30,000.00 a month","['Full-time', 'Permanent']",['Day shift'],Flexible schedule,"Delhi, Delhi","{'Responsibilities': ['Develop and maintain web applications using Laravel', 'Collaborate with the team to deliver high-quality code', 'Troubleshoot and debug issues', 'Stay updated with the latest web development trends'], 'Requirements': ['2-4 years of PHP Laravel development experience', 'Proficiency in PHP, Laravel, and MySQL', 'Strong problem-solving skills', 'Team player with good communication skills'], 'Benefits': ['Flexible schedule', 'Paid time off', 'Work from home'], 'Education': [""Bachelor's (Preferred)""], 'Experience': ['PHP Laravel: 2 years (Preferred)']}"
e247fbc1b186c384,"deivatechnologies, Coimbatore",apply through indeed,https://in.indeed.com/rc/clk?jk=e247fbc1b186c384&bb=gcPkqhtAcrHzwQoLjVh5CCnA34RCb7JcTe9THFQzyFYjziIyJ2sM0Dh1UY0jG4gL0nTZY5GbN0WR4Ps_Ghxp6iq4pF8OBxI63iiCMdyqLVjmFhdLcr1XPnNCBese3Xjr&xkcb=SoBD67M39n1RBi23ah0PbzkdCdPP&fccid=fb28d06f42cead76&cmp=deivatechnologies&ti=Back+End+Developer&vjs=3,10/08/2024,Website developer (frond end and back end developer),,"['Full-time', 'Part-time', 'Temporary']",[],,"Gandhipuram, Coimbatore, Tamil Nadu",
0afe0b0b8805f530,157 CAREERS,apply through indeed,https://in.indeed.com/rc/clk?jk=0afe0b0b8805f530&bb=gcPkqhtAcrHzwQoLjVh5CJm1_WZ3vvt9sdCS0L9KCyX0q0sWoGs4aXA50HsrrwRWsmrgjoxZrUIQHT5zQJP2EKsXdGgWSwfEdhrzshwWLWdqTcm4RLD8TvAyABXLT3Qy&xkcb=SoD367M39n1RBi23ah0ObzkdCdPP&fccid=82971851ac5fcda9&cmp=157-CAREERS&ti=Front+End+Developer&vjs=3,11/08/2024,Front End Developer,"Up to ₹20,00,000 a year","['Full-time', 'Permanent']",['Monday to Friday'],Provident Fund,"Pune, Maharashtra","{'Benefits': ['Provident Fund'], 'Supplemental Pay': ['Performance bonus'], 'Education': [""Bachelor's (Preferred)""], 'Experience': ['Angular: 1 year (Preferred)', 'total work: 5 years (Required)', 'HTML5: 1 year (Preferred)'], 'License/Certification': ['Magneto (Preferred)']}"
19417c448c506587,Adept Digitals,https://in.indeed.com/applystart?jk=19417c448c506587&from=vj&pos=bottom&mvj=0&jobsearchTk=1i57unmofiaho848&spon=0&xkcb=SoBq67M39n1RBi23ah0NbzkdCdPP&xfps=cc88805f-a46f-44df-9d1d-75d576044a85&sjdu=BQ1fOKU6SMjz57AxXCzG64DDplm6SwWjHcxyoDIphKlcMTuTp63onu-RLDdw1aI8BErvjFlC7X8f8aEsBNO33j00uD7m3UHDKzMNE6tl9NFPhOAIbw52mOrJh_fxc0qA8QlfHcs78BDfsSYiO9O7K2Xsa6JDR3w1HVJfAu3sSFAAoHfk8wtU6o19TXLWlBpCw9_XINGINv7OnqX9-Wv1cg&vjfrom=vjs&asub=mob&astse=d8a74692f84be665&assa=8045,https://in.indeed.com/rc/clk?jk=19417c448c506587&bb=gcPkqhtAcrHzwQoLjVh5CPRjWBrhDVABwMHeGNQ5AGSjGihy0-vPbFLwKCpWVSf0-XJBkHtKzczuvcemRd7y5PNv4cwoFJb5stNpXC8L_GnV_1kDWVmxFJiEbjSzp1fQ&xkcb=SoBq67M39n1RBi23ah0NbzkdCdPP&fccid=a16e9722651fe819&vjs=3,06/08/2024,Jr. PHP Developer,"₹18,000 - ₹25,000 a month",['Full-time'],['Day shift'],,,{}
24528a97069bbdcf,APPLISOFT TECHNOLOGIES,apply through indeed,https://in.indeed.com/rc/clk?jk=24528a97069bbdcf&bb=gcPkqhtAcrHzwQoLjVh5CPNXu4fiwTbbqVciqi8JPJDJVo_hQ51Knr7Zb5qHIf-DgtNaUtYi_WkCMRUlMhOEJ0cNmGSG_IYx55WT_zVsdT0D_QDPqZEqOz1zGZJNi4h5&xkcb=SoDe67M39n1RBi23ah0MbzkdCdPP&fccid=d9e487a905637edb&cmp=applisoft-technologies&ti=PHP+Developer&vjs=3,11/08/2024,PHP Developer (Minimum 1 Year Experience),"₹8,000 - ₹24,000 a month","['Full-time', 'Permanent']",['Day shift'],,"Ahmedabad, Gujarat",{}
